{
  "schemaVersion": "claimtrace-audit-bundle/2.6.0",
  "bundleType": "AuditBundle",
  "generatedAt": "2026-08-10T00:00:00.000Z",
  "previousBundleHash": null,
  "project": "CDC PLACES Selected-County Depression Estimate Audit",
  "primaryKey": "county_fips",
  "ruleVersion": "claimtrace-rule/6.3.0",
  "isDemo": true,
  "dataOrigin": "PUBLIC",
  "snapshots": {
    "baseline": {
      "schemaVersion": "claimtrace-snapshot/1.1.0",
      "csvDialectVersion": "claimtrace-csv-strict/1.0.0",
      "normalizationVersion": "claimtrace-normalized-rows/1.0.0",
      "snapshotId": "baseline-43742e0837474322",
      "side": "baseline",
      "fileName": "baseline.csv",
      "sha256": "43742e0837474322829e5e35007d88f814037415371917e003aa80765d23b7b2",
      "normalizedSha256": "17e037c6c700e33962da860041c590d8ae83a97ca42381f2b01749dd88013903",
      "rowCount": 8,
      "byteSize": 580,
      "columns": [
        "county_fips",
        "state",
        "county",
        "data_year",
        "age_adjusted_depression_percent",
        "ci_low_percent",
        "ci_high_percent",
        "adult_population",
        "measure_id"
      ],
      "primaryKey": "county_fips",
      "generatedAt": "2026-08-10T00:00:00.000Z",
      "verifiedAt": "2026-08-10T00:00:00.000Z",
      "verificationStatus": "verified"
    },
    "current": {
      "schemaVersion": "claimtrace-snapshot/1.1.0",
      "csvDialectVersion": "claimtrace-csv-strict/1.0.0",
      "normalizationVersion": "claimtrace-normalized-rows/1.0.0",
      "snapshotId": "current-ed1fd64345d56388",
      "side": "current",
      "fileName": "current.csv",
      "sha256": "ed1fd64345d56388efe7f390f9f09cf5c2c88d564ae99a8e3d8f43aa531d4132",
      "normalizedSha256": "3795fe797fecade2d4a554126b0ee05826b003ba1f1dfba7f03a660efbe8c5d1",
      "rowCount": 8,
      "byteSize": 580,
      "columns": [
        "county_fips",
        "state",
        "county",
        "data_year",
        "age_adjusted_depression_percent",
        "ci_low_percent",
        "ci_high_percent",
        "adult_population",
        "measure_id"
      ],
      "primaryKey": "county_fips",
      "generatedAt": "2026-08-10T00:00:00.000Z",
      "verifiedAt": "2026-08-10T00:00:00.000Z",
      "verificationStatus": "verified"
    }
  },
  "snapshotPayloads": {
    "baseline": {
      "fileName": "baseline.csv",
      "sha256": "43742e0837474322829e5e35007d88f814037415371917e003aa80765d23b7b2",
      "normalizedSha256": "17e037c6c700e33962da860041c590d8ae83a97ca42381f2b01749dd88013903",
      "text": "county_fips,state,county,data_year,age_adjusted_depression_percent,ci_low_percent,ci_high_percent,adult_population,measure_id\n04013,AZ,Maricopa,2022,20.9,18.8,23.1,3532288,DEPRESSION\n06037,CA,Los Angeles,2022,20.4,18.4,22.4,7737357,DEPRESSION\n06075,CA,San Francisco,2022,18.7,16.2,21.3,697737,DEPRESSION\n17031,IL,Cook,2022,17.5,15.4,19.9,4039681,DEPRESSION\n25017,MA,Middlesex,2022,23.4,21.1,25.6,1305661,DEPRESSION\n36061,NY,New York,2022,20.8,18.9,23.0,1372389,DEPRESSION\n48201,TX,Harris,2022,20.1,17.7,22.5,3550425,DEPRESSION\n53033,WA,King,2022,23.0,21.4,24.6,1831091,DEPRESSION\n",
      "rawBytesBase64": "Y291bnR5X2ZpcHMsc3RhdGUsY291bnR5LGRhdGFfeWVhcixhZ2VfYWRqdXN0ZWRfZGVwcmVzc2lvbl9wZXJjZW50LGNpX2xvd19wZXJjZW50LGNpX2hpZ2hfcGVyY2VudCxhZHVsdF9wb3B1bGF0aW9uLG1lYXN1cmVfaWQKMDQwMTMsQVosTWFyaWNvcGEsMjAyMiwyMC45LDE4LjgsMjMuMSwzNTMyMjg4LERFUFJFU1NJT04KMDYwMzcsQ0EsTG9zIEFuZ2VsZXMsMjAyMiwyMC40LDE4LjQsMjIuNCw3NzM3MzU3LERFUFJFU1NJT04KMDYwNzUsQ0EsU2FuIEZyYW5jaXNjbywyMDIyLDE4LjcsMTYuMiwyMS4zLDY5NzczNyxERVBSRVNTSU9OCjE3MDMxLElMLENvb2ssMjAyMiwxNy41LDE1LjQsMTkuOSw0MDM5NjgxLERFUFJFU1NJT04KMjUwMTcsTUEsTWlkZGxlc2V4LDIwMjIsMjMuNCwyMS4xLDI1LjYsMTMwNTY2MSxERVBSRVNTSU9OCjM2MDYxLE5ZLE5ldyBZb3JrLDIwMjIsMjAuOCwxOC45LDIzLjAsMTM3MjM4OSxERVBSRVNTSU9OCjQ4MjAxLFRYLEhhcnJpcywyMDIyLDIwLjEsMTcuNywyMi41LDM1NTA0MjUsREVQUkVTU0lPTgo1MzAzMyxXQSxLaW5nLDIwMjIsMjMuMCwyMS40LDI0LjYsMTgzMTA5MSxERVBSRVNTSU9OCg=="
    },
    "current": {
      "fileName": "current.csv",
      "sha256": "ed1fd64345d56388efe7f390f9f09cf5c2c88d564ae99a8e3d8f43aa531d4132",
      "normalizedSha256": "3795fe797fecade2d4a554126b0ee05826b003ba1f1dfba7f03a660efbe8c5d1",
      "text": "county_fips,state,county,data_year,age_adjusted_depression_percent,ci_low_percent,ci_high_percent,adult_population,measure_id\n04013,AZ,Maricopa,2023,18.9,17.0,20.9,3572375,DEPRESSION\n06037,CA,Los Angeles,2023,19.3,17.5,21.3,7710575,DEPRESSION\n06075,CA,San Francisco,2023,19.8,17.1,22.8,698599,DEPRESSION\n17031,IL,Cook,2023,19.0,16.8,21.3,4031580,DEPRESSION\n25017,MA,Middlesex,2023,24.1,21.7,26.6,1310019,DEPRESSION\n36061,NY,New York,2023,18.6,16.8,20.7,1381420,DEPRESSION\n48201,TX,Harris,2023,19.5,17.0,22.1,3595915,DEPRESSION\n53033,WA,King,2023,23.4,21.7,25.3,1836529,DEPRESSION\n",
      "rawBytesBase64": "Y291bnR5X2ZpcHMsc3RhdGUsY291bnR5LGRhdGFfeWVhcixhZ2VfYWRqdXN0ZWRfZGVwcmVzc2lvbl9wZXJjZW50LGNpX2xvd19wZXJjZW50LGNpX2hpZ2hfcGVyY2VudCxhZHVsdF9wb3B1bGF0aW9uLG1lYXN1cmVfaWQKMDQwMTMsQVosTWFyaWNvcGEsMjAyMywxOC45LDE3LjAsMjAuOSwzNTcyMzc1LERFUFJFU1NJT04KMDYwMzcsQ0EsTG9zIEFuZ2VsZXMsMjAyMywxOS4zLDE3LjUsMjEuMyw3NzEwNTc1LERFUFJFU1NJT04KMDYwNzUsQ0EsU2FuIEZyYW5jaXNjbywyMDIzLDE5LjgsMTcuMSwyMi44LDY5ODU5OSxERVBSRVNTSU9OCjE3MDMxLElMLENvb2ssMjAyMywxOS4wLDE2LjgsMjEuMyw0MDMxNTgwLERFUFJFU1NJT04KMjUwMTcsTUEsTWlkZGxlc2V4LDIwMjMsMjQuMSwyMS43LDI2LjYsMTMxMDAxOSxERVBSRVNTSU9OCjM2MDYxLE5ZLE5ldyBZb3JrLDIwMjMsMTguNiwxNi44LDIwLjcsMTM4MTQyMCxERVBSRVNTSU9OCjQ4MjAxLFRYLEhhcnJpcywyMDIzLDE5LjUsMTcuMCwyMi4xLDM1OTU5MTUsREVQUkVTU0lPTgo1MzAzMyxXQSxLaW5nLDIwMjMsMjMuNCwyMS43LDI1LjMsMTgzNjUyOSxERVBSRVNTSU9OCg=="
    }
  },
  "summary": {
    "total": 4,
    "supported": 2,
    "weakened": 0,
    "reversed": 1,
    "untestable": 0,
    "reviewRequired": 1,
    "completenessChecksPassed": 64,
    "completenessChecksTotal": 64,
    "evidenceCoverage": 100,
    "changedRecords": 8
  },
  "diffSummary": {
    "totalChanged": 8,
    "exported": 8,
    "truncated": false,
    "limit": 500
  },
  "diffs": [
    {
      "key": "04013",
      "kind": "changed",
      "changedFields": [
        "data_year",
        "age_adjusted_depression_percent",
        "ci_low_percent",
        "ci_high_percent",
        "adult_population"
      ],
      "baseline": {
        "county_fips": "04013",
        "state": "AZ",
        "county": "Maricopa",
        "data_year": "2022",
        "age_adjusted_depression_percent": "20.9",
        "ci_low_percent": "18.8",
        "ci_high_percent": "23.1",
        "adult_population": "3532288",
        "measure_id": "DEPRESSION"
      },
      "current": {
        "county_fips": "04013",
        "state": "AZ",
        "county": "Maricopa",
        "data_year": "2023",
        "age_adjusted_depression_percent": "18.9",
        "ci_low_percent": "17.0",
        "ci_high_percent": "20.9",
        "adult_population": "3572375",
        "measure_id": "DEPRESSION"
      },
      "baselineLine": 2,
      "currentLine": 2
    },
    {
      "key": "06037",
      "kind": "changed",
      "changedFields": [
        "data_year",
        "age_adjusted_depression_percent",
        "ci_low_percent",
        "ci_high_percent",
        "adult_population"
      ],
      "baseline": {
        "county_fips": "06037",
        "state": "CA",
        "county": "Los Angeles",
        "data_year": "2022",
        "age_adjusted_depression_percent": "20.4",
        "ci_low_percent": "18.4",
        "ci_high_percent": "22.4",
        "adult_population": "7737357",
        "measure_id": "DEPRESSION"
      },
      "current": {
        "county_fips": "06037",
        "state": "CA",
        "county": "Los Angeles",
        "data_year": "2023",
        "age_adjusted_depression_percent": "19.3",
        "ci_low_percent": "17.5",
        "ci_high_percent": "21.3",
        "adult_population": "7710575",
        "measure_id": "DEPRESSION"
      },
      "baselineLine": 3,
      "currentLine": 3
    },
    {
      "key": "06075",
      "kind": "changed",
      "changedFields": [
        "data_year",
        "age_adjusted_depression_percent",
        "ci_low_percent",
        "ci_high_percent",
        "adult_population"
      ],
      "baseline": {
        "county_fips": "06075",
        "state": "CA",
        "county": "San Francisco",
        "data_year": "2022",
        "age_adjusted_depression_percent": "18.7",
        "ci_low_percent": "16.2",
        "ci_high_percent": "21.3",
        "adult_population": "697737",
        "measure_id": "DEPRESSION"
      },
      "current": {
        "county_fips": "06075",
        "state": "CA",
        "county": "San Francisco",
        "data_year": "2023",
        "age_adjusted_depression_percent": "19.8",
        "ci_low_percent": "17.1",
        "ci_high_percent": "22.8",
        "adult_population": "698599",
        "measure_id": "DEPRESSION"
      },
      "baselineLine": 4,
      "currentLine": 4
    },
    {
      "key": "17031",
      "kind": "changed",
      "changedFields": [
        "data_year",
        "age_adjusted_depression_percent",
        "ci_low_percent",
        "ci_high_percent",
        "adult_population"
      ],
      "baseline": {
        "county_fips": "17031",
        "state": "IL",
        "county": "Cook",
        "data_year": "2022",
        "age_adjusted_depression_percent": "17.5",
        "ci_low_percent": "15.4",
        "ci_high_percent": "19.9",
        "adult_population": "4039681",
        "measure_id": "DEPRESSION"
      },
      "current": {
        "county_fips": "17031",
        "state": "IL",
        "county": "Cook",
        "data_year": "2023",
        "age_adjusted_depression_percent": "19.0",
        "ci_low_percent": "16.8",
        "ci_high_percent": "21.3",
        "adult_population": "4031580",
        "measure_id": "DEPRESSION"
      },
      "baselineLine": 5,
      "currentLine": 5
    },
    {
      "key": "25017",
      "kind": "changed",
      "changedFields": [
        "data_year",
        "age_adjusted_depression_percent",
        "ci_low_percent",